{
  "$schema": "./schema.json",
  "name": "development",
  "flavor": "dev",
  "app_name": "Tattoo",
  "ENV": "development",
  "FLAVOR": "dev",
  "APP_NAME": "Tattoo",
  "APP_CONFIG_NAME": "Tattoo",
  "APP_CONFIG_ICON_NAME": "AppIcon-dev",
  "ANDROID_APPLICATION_ID": "club.ntut.tattoo",
  "ANDROID_APP_LABEL": "Tattoo",
  "ANDROID_RES_DIR": "android/app/src/dev/res",
  "ANDROID_FIREBASE_CONFIG_PATH": "android/app/google-services.json",
  "IOS_BUNDLE_IDENTIFIER": "club.ntut.tattoo",
  "IOS_BUNDLE_DISPLAY_NAME": "Tattoo",
  "IOS_APP_ICON_NAME": "AppIcon-dev",
  "IOS_FIREBASE_CONFIG_PATH": "ios/Runner/GoogleService-Info.plist",
  "android": {
    "application_id": "club.ntut.tattoo",
    "app_name": "Tattoo",
    "icon": "ic_launcher",
    "res_dir": "android/app/src/dev/res",
    "google_services_path": "android/app/google-services.json"
  },
  "ios": {
    "bundle_identifier": "club.ntut.tattoo",
    "bundle_display_name": "Tattoo",
    "app_icon_name": "AppIcon-dev",
    "google_service_info_path": "ios/Runner/GoogleService-Info.plist"
  },
  "firebase": {
    "project_id": "npc-tattoo",
    "storage_bucket": "npc-tattoo.firebasestorage.app",
    "android": {
      "package_name": "club.ntut.tattoo",
      "app_id": "1:838220085712:android:a85cf2541699925c3be1d5"
    },
    "ios": {
      "bundle_id": "club.ntut.tattoo",
      "app_id": "1:838220085712:ios:d5b7636cdc72fd603be1d5"
    }
  }
}
